Sheet: Inflation
A1: Année | B1: Inflation | C1: Cumul inflation | D1: Inflation totale | E1: of:=[.C27]-1 -> 0.522966174927755 | H1: Année | I1: Indice | J1: Indice mensuel | L1: Différence : | M1: of:=[.J21]-[.J2] -> 0.655989422553613
H2: 2000 | I2: 51.2015269293567 | J2: of:=[.I2]/12 -> 4.26679391077972 | L2: En % | M2: of:=[.M1]/[.J2] -> 0.15374293586018
A3: 2000 | B3: 1.7 | C3: of:=1+(1*[.B3]/100) -> 1.017 | H3: 2001 | I3: 51.4576412783155 | J3: of:=[.I3]/12 -> 4.28813677319296
A4: 2001 | B4: 1.6 | C4: of:=[.C3]+([.C3]*([.B4]/100)) -> 1.033272 | H4: 2001 | I4: 51.8174209589958 | J4: of:=[.I4]/12 -> 4.31811841324965
A5: 2002 | B5: 1.9 | C5: of:=[.C4]+([.C4]*([.B5]/100)) -> 1.052904168 | H5: 2002-03-01 | I5: 52.1284 | J5: of:=[.I5]/12 -> 4.34403333333333
A6: 2003 | B6: 2.1 | C6: of:=[.C5]+([.C5]*([.B6]/100)) -> 1.075015155528 | H6: 2002-12-01 | I6: 52.4933 | J6: of:=[.I6]/12 -> 4.37444166666667
A7: 2004 | B7: 2.1 | C7: of:=[.C6]+([.C6]*([.B7]/100)) -> 1.09759047379409 | H7: 2004-01-01 | I7: 52.7558 | J7: of:=[.I7]/12 -> 4.39631666666667
A8: 2005 | B8: 1.7 | C8: of:=[.C7]+([.C7]*([.B8]/100)) -> 1.11624951184859 | H8: 2005-02-01 | I8: 53.0196 | J8: of:=[.I8]/12 -> 4.4183
A9: 2006 | B9: 1.7 | C9: of:=[.C8]+([.C8]*([.B9]/100)) -> 1.13522575355001 | H9: 2005-07-01 | I9: 53.2847 | J9: of:=[.I9]/12 -> 4.44039166666667
A10: 2007 | B10: 1.5 | C10: of:=[.C9]+([.C9]*([.B10]/100)) -> 1.15225413985326 | H10: 2005-11-01 | I10: 53.711 | J10: of:=[.I10]/12 -> 4.47591666666667
A11: 2008 | B11: 2.8 | C11: of:=[.C10]+([.C10]*([.B11]/100)) -> 1.18451725576916 | H11: 2006-07-01 | I11: 53.9795 | J11: of:=[.I11]/12 -> 4.49829166666667
A12: 2009 | B12: 0.1 | C12: of:=[.C11]+([.C11]*([.B12]/100)) -> 1.18570177302492 | H12: 2007-02-01 | I12: 54.4113 | J12: of:=[.I12]/12 -> 4.534275
A13: 2010 | B13: 1.5 | C13: of:=[.C12]+([.C12]*([.B13]/100)) -> 1.2034872996203 | H13: 2008-03-01 | I13: 54.6834 | J13: of:=[.I13]/12 -> 4.55695
A14: 2011 | B14: 2.1 | C14: of:=[.C13]+([.C13]*([.B14]/100)) -> 1.22876053291232 | H14: 2008-10-01 | I14: 54.8475 | J14: of:=[.I14]/12 -> 4.570625
A15: 2012 | B15: 2 | C15: of:=[.C14]+([.C14]*([.B15]/100)) -> 1.25333574357057 | H15: 2009-07-01 | I15: 55.1217 | J15: of:=[.I15]/12 -> 4.593475
A16: 2013 | B16: 0.9 | C16: of:=[.C15]+([.C15]*([.B16]/100)) -> 1.26461576526271 | H16: 2009-10-01 | I16: 55.2871 | J16: of:=[.I16]/12 -> 4.60725833333333
A17: 2014 | B17: 0.5 | C17: of:=[.C16]+([.C16]*([.B17]/100)) -> 1.27093884408902 | H17: 2010-07-01 | I17: 55.5635 | J17: of:=[.I17]/12 -> 4.63029166666667
A18: 2015 | B18: 0 | C18: of:=[.C17]+([.C17]*([.B18]/100)) -> 1.27093884408902 | H18: 2016-07-01 | I18: 55.8969 | J18: of:=[.I18]/12 -> 4.658075
A19: 2016 | B19: 0.2 | C19: of:=[.C18]+([.C18]*([.B19]/100)) -> 1.2734807217772 | H19: 2017-02-01 | I19: 56.2323 | J19: of:=[.I19]/12 -> 4.686025
A20: 2017 | B20: 1 | C20: of:=[.C19]+([.C19]*([.B20]/100)) -> 1.28621552899497 | H20: 2022-07-01 | I20: 58.2004 | J20: of:=[.I20]/12 -> 4.85003333333333
A21: 2018 | B21: 1.9 | C21: of:=[.C20]+([.C20]*([.B21]/100)) -> 1.31065362404587 | H21: 2023-07-01 | I21: 59.0734 | J21: of:=[.I21]/12 -> 4.92278333333333
A22: 2019 | B22: 1.1 | C22: of:=[.C21]+([.C21]*([.B22]/100)) -> 1.32507081391038
A23: 2020 | B23: 0.5 | C23: of:=[.C22]+([.C22]*([.B23]/100)) -> 1.33169616797993
A24: 2021 | B24: 1.6 | C24: of:=[.C23]+([.C23]*([.B24]/100)) -> 1.35300330666761
A25: 2022 | B25: 5.2 | C25: of:=[.C24]+([.C24]*([.B25]/100)) -> 1.42335947861433
A26: 2023 | B26: 4.9 | C26: of:=[.C25]+([.C25]*([.B26]/100)) -> 1.49310409306643
A27: 2024 | B27: 2 | C27: of:=[.C26]+([.C26]*([.B27]/100)) -> 1.52296617492776